103389;CANARA ROBECO INFRASTRUCTURE FUND - REGULAR PLAN - IDCW (Payout/Reinvestment);INF760K01258;INF760K01266;17.9600;17.9600;17.9600;16-Feb-2012

DSP Mutual Fund
102434;DSP India T.I.G.E.R. Fund - Regular Plan - Growth;INF740K01151;;42.614;42.188;42.614;16-Feb-2012
102435;DSP India T.I.G.E.R. Fund - Regular Plan - IDCW;INF740K01136;INF740K01144;16.358;16.194;16.358;16-Feb-2012
108202;DSP Natural Resources And New Energy Fund - Regular - Growth;INF740K01060;;13.886;13.747;13.886;16-Feb-2012
108203;DSP Natural Resources And New Energy Fund - Regular Plan - IDCW;INF740K01045;INF740K01052;12.407;12.283;12.407;16-Feb-2012

Franklin Templeton Mutual Fund
106979;Franklin Asian Equity Fund - Growth Plan;INF090I01AB3;;11.5838;11.4680;11.5838;16-Feb-2012
106978;Franklin Asian Equity Fund - IDCW ;INF090I01999;INF090I01AA5;11.5838;11.4680;11.5838;16-Feb-2012
112093;Franklin Build India Fund - IDCW ;INF090I01AC1;INF090I01AD9;11.0291;10.9188;11.0291;16-Feb-2012
112092;Franklin Build India Fund Growth Plan;INF090I01AE7;;11.5459;11.4304;11.5459;16-Feb-2012
103151;Franklin India Opportunities Fund - Growth;INF090I01841;;30.7994;30.4914;30.7994;16-Feb-2012
100524;Franklin INDIA OPPORTUNITIES FUND - IDCW ;INF090I01858;INF090I01866;13.1579;13.0263;13.1579;16-Feb-2012
100521;Franklin India Technology Fund - IDCW ;INF090I01759;INF090I01767;18.7491;18.5616;18.7491;16-Feb-2012
100522;Franklin India Technology Fund-Growth;INF090I01742;;65.8473;65.1888;65.8473;16-Feb-2012

HDFC Mutual Fund
107524;HDFC Infrastructure Fund - Growth Plan;INF179K01GF8;;10.825;10.717;10.825;16-Feb-2012
107525;HDFC Infrastructure Fund - IDCW Plan;INF179K01GE1;INF179K01GG6;10.825;10.717;10.825;16-Feb-2012

ICICI Prudential Mutual Fund
109445;ICICI Prudential Banking and Financial Services Fund -  Growth;INF109K01BU5;;17.78;17.60;17.78;16-Feb-2012
109446;ICICI Prudential Banking and Financial Services Fund -  IDCW;INF109K01DY3;INF109K01BV3;17.43;17.26;17.43;16-Feb-2012
103312;ICICI Prudential Exports & Services Fund - Growth;INF109K01BB5;;17.52;17.34;17.52;16-Feb-2012
103313;ICICI Prudential Exports & Services Fund - IDCW;INF109K01FL5;INF109K01BA7;13.18;13.05;13.18;16-Feb-2012
100352;ICICI Prudential FMCG Fund - Growth;INF109K01415;;79.07;78.28;79.07;16-Feb-2012
100351;ICICI Prudential FMCG Fund - IDCW;INF109K01EO2;INF109K01423;42.73;42.30;42.73;16-Feb-2012
103149;ICICI Prudential Infrastructure Fund - Growth;INF109K01AV5;;27.12;26.85;27.12;16-Feb-2012
103150;ICICI Prudential Infrastructure Fund - IDCW;INF109K01FB6;INF109K01AT9;10.93;10.82;10.93;16-Feb-2012
107927;ICICI Prudential Infrastructure Fund - Institutional Option - Dividend;;INF109K01TE1;10.39;10.29;10.39;16-Feb-2012
105602;ICICI Prudential Infrastructure Fund - Institutional Option - I - Growth;INF109K01AU7;;14.85;14.70;14.85;16-Feb-2012
100363;ICICI Prudential Technology Fund - Growth;INF109K01506;;18.33;18.15;18.33;16-Feb-2012
115294;ICICI Prudential Technology Fund - IDCW;INF109K01FO9;INF109K01514;18.33;18.15;18.33;16-Feb-2012

Invesco Mutual Fund
108377;Invesco India Financial Services Fund - Regular Plan -  IDCW (Payout / Reinvestment);INF205K01171;INF205K01163;15.40;15.25;15.40;16-Feb-2012
108378;Invesco India Financial Services Fund - Retail Growth;INF205K01155;;19.86;19.66;19.86;16-Feb-2012
106654;Invesco India Infrastructure Fund - Growth Option;INF205K01CD5;;7.55;7.47;7.55;16-Feb-2012
106653;Invesco India Infrastructure Fund - IDCW (Payout / Reinvestment);INF205K01CE3;INF205K01CF0;7.55;7.47;7.55;16-Feb-2012
112171;Invesco India PSU Equity Fund - Growth;INF205K01338;;10.26;10.16;10.26;16-Feb-2012
112173;Invesco India PSU Equity Fund - IDCW (Payout / Reinvestment);INF205K01353;INF205K01346;9.26;9.17;9.26;16-Feb-2012

L&T Mutual Fund
112600;L&T Infrastructure Fund - Regular Plan - Growth;INF917K01536;;6.44;6.44;6.44;16-Feb-2012
112601;L&T Infrastructure Fund - Regular Plan - IDCW;INF917K01544;INF917K01551;6.44;6.44;6.44;16-Feb-2012

Mirae Asset Mutual Fund
114931;Mirae Asset Great Consumer Fund - Regular Plan - Growth option;INF769K01135;;10.902;10.793;10.902;16-Feb-2012
114930;Mirae Asset Great Consumer Fund Regular IDCW;INF769K01150;INF769K01143;10.902;10.793;10.902;16-Feb-2012

Nippon India Mutual Fund
101864;Nippon India Banking & Financial Services Fund - IDCW Option;INF204K01893;INF204K01901;38.0752;37.6944;38.0752;16-Feb-2012
101863;Nippon India Banking & Financial Services Fund-Growth Plan-Bonus Option;INF204K01919;;101.8753;100.8565;101.8753;16-Feb-2012
101862;Nippon India Banking & Financial Services Fund-Growth Plan-Growth Option;INF204K01927;;101.8605;100.8419;101.8605;16-Feb-2012
110254;Reliance Banking & Financial Services Fund - Institutional Plan - Dividend Option;INF204K01869;INF204K01877;10.8334;10.7251;10.8334;16-Feb-2012
110252;Reliance Banking & Financial Services Fund - Institutional Plan - Growth Option;INF204K01885;;9.1630;9.0714;9.1630;16-Feb-2012
102753;NIPPON INDIA CONSUMPTION FUND - IDCW Option;INF204K01AN1;INF204K01AO9;18.5158;18.3306;18.5158;16-Feb-2012
102752;Nippon India Consumption Fund-Growth Plan-Bonus Option;INF204K01AP6;;29.9297;29.6304;29.9297;16-Feb-2012
102751;Nippon India Consumption Fund-Growth Plan-Growth Option;INF204K01AQ4;;29.9297;29.6304;29.9297;16-Feb-2012
102433;NIPPON INDIA PHARMA FUND - IDCW Option;INF204K01935;INF204K01943;38.4961;38.1111;38.4961;16-Feb-2012
102432;Nippon India Pharma Fund-Growth Plan-Bonus Option;INF204K01950;;55.3474;54.7939;55.3474;16-Feb-2012
102431;Nippon India Pharma Fund-Growth Plan-Growth Option;INF204K01968;;55.3474;54.7939;55.3474;16-Feb-2012
101264;NIPPON INDIA POWER & INFRA FUND - IDCW Option;INF204K01AB6;INF204K01AC4;34.2770;33.9342;34.2770;16-Feb-2012
101262;Nippon India Power & Infra Fund-Growth Plan -Growth Option;INF204K01AE0;;60.3623;59.7587;60.3623;16-Feb-2012
101263;Nippon India Power & Infra Fund-Growth Plan-Bonus Option;INF204K01AD2;;60.3621;59.7585;60.3621;16-Feb-2012
108252;NIPPON INDIA QUANT FUND - IDCW Option;INF204K01745;INF204K01752;10.9742;10.8645;10.9742;16-Feb-2012
108249;Nippon India Quant Fund -Growth Plan - Growth Option;INF204K01760;;13.4385;13.3041;13.4385;16-Feb-2012
108258;Nippon India Quant Fund -Growth Plan -Bonus Option;INF204K01737;;13.4385;13.3041;13.4385;16-Feb-2012

quant Mutual Fund
106170;quant Infrastructure Fund - Growth Option;INF966L01523;;6.2447;6.1733;6.2447;16-Feb-2012
106169;quant Infrastructure Fund - IDCW Option - Regular Plan;INF966L01507;INF966L01515;6.2483;6.1769;6.2483;16-Feb-2012

Sundaram Mutual Fund
112295;Sundaram PSU Opportunities Dividend Option;INF903J01892;INF903J01900;9.5348;9.4395;9.5348;16-Feb-2012
112294;Sundaram PSU Opportunities Growth Option;INF903J01884;;10.4703;10.3656;10.4703;16-Feb-2012
113373;Sundaram Consumption Fund (Formerly Known as Sundaram Rural and Consumption Fund Institutional Plan - Income Distribution cum Capital Withdrawal (IDCW);INF903J01579;INF903J01587;15.2856;15.2856;15.2856;16-Feb-2012
103743;Sundaram Consumption Fund (Formerly Known as Sundaram Rural and Consumption Fund Regular Plan - Income Distribution cum Capital Withdrawal (IDCW);INF903J01546;INF903J01553;10.7389;10.6315;10.7389;16-Feb-2012
102142;Sundaram Consumption Fund(Formerly Known as Sundaram Rural and Consumption Fund Regular Plan - Growth);INF903J01561;;14.8423;14.6939;14.8423;16-Feb-2012
109061;Sundaram Financial Services Opportunities Fund Institutional Plan - Growth;INF903J01652;;19.7475;19.7475;19.7475;16-Feb-2012
109060;Sundaram Financial Services Opportunities Fund Institutional Plan - Income Distribution cum Capital Withdrawal (IDCW);INF903J01637;INF903J01645;12.6131;12.6131;12.6131;16-Feb-2012
109059;Sundaram Financial Services Opportunities Fund Regular Plan - Growth;INF903J01629;;19.4378;19.2434;19.4378;16-Feb-2012
109058;Sundaram Financial Services Opportunities Fund Regular Plan - Income Distribution cum Capital Withdrawal (IDCW);INF903J01603;INF903J01611;12.4527;12.3282;12.4527;16-Feb-2012

Tata Mutual Fund
101833;Tata Ethical Fund- Regular Plan - Payout of IDCW Option;INF277K01EH1;INF277K01949;42.4405;42.0161;42.4405;16-Feb-2012
100415;Tata Ethical Fund-Regular Plan - Growth Option;INF277K01956;;65.6961;65.0391;65.6961;16-Feb-2012
101852;TATA Infrastructure Fund Regular Plan - Payout of IDCW Option;INF277K01DY8;INF277K01774;19.3250;19.1318;19.3250;16-Feb-2012
101766;Tata Infrastructure Fund-Regular Plan- Growth Option;INF277K01782;;29.3249;29.0317;29.3249;16-Feb-2012

Taurus Mutual Fund
111903;Taurus Ethical Fund -  Regular Plan - Bonus Option;INF044D01823;;22.66;22.43;22.66;16-Feb-2012
111787;Taurus Ethical Fund - Regular Plan - Growth;INF044D01864;;22.65;22.42;22.65;16-Feb-2012
111788;Taurus Ethical Fund - Regular Plan - Payout of Income Distribution cum Capital Withdrawal option;INF044D01831;INF044D01849;15.30;15.15;15.30;16-Feb-2012
105417;Taurus Infrastructure Fund - Regular Plan - Growth;INF044D01906;;12.36;12.24;12.36;16-Feb-2012
105418;Taurus Infrastructure Fund - Regular Plan - Payout of Income Distribution cum Capital Withdrawal option;INF044D01872;INF044D01880;11.59;11.47;11.59;16-Feb-2012

UTI Mutual Fund
102401;UTI Banking and Financial Services Fund - Regular Plan - Growth Option;INF789F01372;;42.95;42.95;42.95;16-Feb-2012
102402;UTI Banking and Financial Services Fund - Regular Plan - IDCW;INF789F01356;INF789F01364;19.78;19.78;19.78;16-Feb-2012
100805;UTI Energy Fund-Growth Option;INF789F01497;;9.84;9.84;9.84;16-Feb-2012
100804;UTI Energy Fund-Income Option;INF789F01471;INF789F01489;11.14;11.14;11.14;16-Feb-2012
100807;UTI Healthcare Fund - Regular Plan - Growth Option;INF789F01695;;39.78;39.78;39.78;16-Feb-2012
100806;UTI Healthcare Fund - Regular Plan - IDCW;INF789F01679;INF789F01687;30.75;30.75;30.75;16-Feb-2012
100809;UTI Services Industries Fund-Growth Option;INF789F01729;;58.31;58.31;58.31;16-Feb-2012
100808;UTI Services Industries Fund-Income Option;INF789F01703;INF789F01711;25.07;25.07;25.07;16-Feb-2012
106425;UTI India Consumer Fund - Regular Plan - Growth Option;INF789F01CE6;;12.29;12.29;12.29;16-Feb-2012
106426;UTI India Consumer Fund - Regular Plan - IDCW;INF789F01CF3;INF789F01CG1;12.29;12.29;12.29;16-Feb-2012
102396;UTI Infrastructure Fund - Regular Plan - IDCW;INF789F01737;INF789F01745;16.58;16.58;16.58;16-Feb-2012
102395;UTI Infrastructure Fund-Growth Option;INF789F01752;;29.16;29.16;29.16;16-Feb-2012
100740;UTI - MNC Fund - Regular Plan - Growth Option;INF789F01844;;64.74;64.74;64.74;16-Feb-2012
100739;UTI MNC Fund - Regular Plan - IDCW;INF789F01828;INF789F01836;41.8;41.8;41.8;16-Feb-2012
102397;UTI Transportation and Logistics Fund - Regular Plan - IDCW;INF789F01273;INF789F01281;14.63;14.63;14.63;16-Feb-2012
102398;UTI-Transportation and Logistics  Fund-Growth Option;INF789F01299;;29.22;29.22;29.22;16-Feb-2012

Open Ended Schemes ( Equity Scheme - ELSS )


Aditya Birla Sun Life Mutual Fund
107745;Aditya Birla Sun Life ELSS Tax Saver Fund - Growth Option;INF209K01108;;10.36;10.36;10.36;16-Feb-2012
103164;Aditya Birla Sun Life ELSS Tax Saver Fund-Regular - IDCW;INF209K01090;INF209K01CB1;73.10;73.10;73.10;16-Feb-2012
104331;Aditya Birla Sun Life Tax Plan - Regular Plan - Growth Option;INF209K01348;;13.41;13.41;13.41;16-Feb-2012
100067;Aditya Birla Sun Life Tax Plan -Regular - IDCW;INF209K01330;INF209K01CM8;44.18;44.18;44.18;16-Feb-2012

Axis Mutual Fund
112323;Axis ELSS Tax Saver Fund - Regular Plan - Growth;INF846K01131;;12.8034;12.8034;12.8034;16-Feb-2012
112322;Axis ELSS Tax Saver Fund - Regular Plan - IDCW;INF846K01149;INF846K01156;11.7278;11.7278;11.7278;16-Feb-2012

Bandhan Mutual Fund
111569;BANDHAN ELSS Tax Saver Fund - Regular Plan - Growth;INF194K01292;;19.7483;19.7483;19.7483;16-Feb-2012
111570;BANDHAN ELSS Tax Saver Fund - Regular Plan - IDCW;INF194K01300;INF194K01318;12.1784;12.1784;12.1784;16-Feb-2012

Bank of India Mutual Fund
111709;BANK OF INDIA ELSS Tax Saver -ECO Plan-Growth;INF761K01157;;21.64;21.64;21.64;16-Feb-2012
111711;BANK OF INDIA ELSS Tax Saver -ECO Plan-IDCW;INF761K01132;INF761K01140;11.78;11.78;11.78;16-Feb-2012
111710;BANK OF INDIA ELSS Tax Saver -Regular Plan- Growth;INF761K01181;;21.49;21.49;21.49;16-Feb-2012
111708;BANK OF INDIA ELSS Tax Saver -Regular Plan-IDCW;INF761K01165;INF761K01173;11.72;11.72;11.72;16-Feb-2012

Baroda BNP Paribas Mutual Fund
100068;BARODA ELSS 96 - Plan A - IDCW;INF955L01641;;22.91;22.91;22.91;16-Feb-2012

BNP Paribas Mutual Fund
113463;BNP Paribas Long Term Equity Fund - Growth Option;INF251K01985;;14.412;14.412;14.412;16-Feb-2012
113464;BNP Paribas Long Term Equity Fund-Income Distribution cum Capital Withdrawal Option;INF251K01AA9;INF251K01993;11.481;11.481;11.481;16-Feb-2012

Canara Robeco Mutual Fund
111722;CANARA ROBECO ELSS TAX SAVER - REGULAR PLAN - GROWTH OPTION;INF760K01100;;26.2600;26.2600;26.2600;16-Feb-2012
100593;CANARA ROBECO ELSS TAX SAVER - REGULAR PLAN -IDCW (Payout);INF760K01084;INF760K01092;18.5100;18.5100;18.5100;16-Feb-2012

DSP Mutual Fund
104772;DSP ELSS Tax Saver Fund - Regular Plan - Growth;INF740K01185;;16.135;16.135;16.135;16-Feb-2012
104773;DSP ELSS Tax Saver Fund - Regular Plan - IDCW;INF740K01169;INF740K01177;11.513;11.513;11.513;16-Feb-2012

Edelweiss Mutual Fund
111638;Edelweiss ELSS Tax Saver Fund - Regular Plan - Growth Option;INF754K01517;;19.08;19.08;19.08;16-Feb-2012
111639;Edelweiss ELSS Tax Saver Fund - Regular Plan - IDCW Option;INF754K01525;INF754K01541;13.08;13.08;13.08;16-Feb-2012

Franklin Templeton Mutual Fund
100525;Franklin India ELSS Tax Saver Fund - IDCW;INF090I01783;INF090I01791;28.1261;28.1261;28.1261;16-Feb-2012
100526;Franklin India ELSS Tax Saver Fund-Growth;INF090I01775;;215.0296;215.0296;215.0296;16-Feb-2012

HDFC Mutual Fund
101979;HDFC ELSS Tax saver - Growth Plan;INF179K01BB8;;226.817;226.817;226.817;16-Feb-2012
101980;HDFC ELSS Tax saver - IDCW Plan;INF179K01AZ9;INF179K01BA0;57.624;57.624;57.624;16-Feb-2012
100998;HDFC Long Term Advantage Plan - Growth Plan;INF179K01996;;136.151;136.151;136.151;16-Feb-2012
100997;HDFC Long Term Advantage Plan - IDCW Plan;INF179K01970;INF179K01988;31.498;31.498;31.498;16-Feb-2012

HSBC Mutual Fund
104707;HSBC Tax Saver Equity Fund - Growth;INF336L01BA4;;14.0424;14.0424;14.0424;16-Feb-2012
104706;HSBC Tax Saver Equity Fund - IDCW;INF336L01AZ3;;12.9513;12.9513;12.9513;16-Feb-2012

ICICI Prudential Mutual Fund
100354;ICICI Prudential ELSS Tax Saver Fund - Growth;INF109K01464;;138.11;138.11;138.11;16-Feb-2012
100353;ICICI Prudential ELSS Tax Saver Fund - IDCW;INF109K01FN1;INF109K01472;18.56;18.56;18.56;16-Feb-2012

Invesco Mutual Fund
104636;Invesco India ELSS Tax Saver Fund - Growth;INF205K01270;;17.58;17.58;17.58;16-Feb-2012
104635;Invesco India ELSS Tax Saver Fund - IDCW (Payout / Reinvestment);INF205K01296;INF205K01288;11.77;11.77;11.77;16-Feb-2012

JM Financial Mutual Fund
107288;JM ELSS Tax Saver Fund (Regular) - Growth option;INF192K01650;;6.6227;0.0000;6.6227;16-Feb-2012
107287;JM ELSS Tax Saver Fund (Regular) - IDCW;INF192K01643;;6.6227;0.0000;6.6227;16-Feb-2012

Kotak Mahindra Mutual Fund
103339;Kotak ELSS Tax Saver Fund-Growth;INF174K01369;;17.668;17.668;17.668;16-Feb-2012
103338;Kotak ELSS Tax Saver Fund-Payout of Income Distribution cum capital withdrawal option;INF174K01385;INF174K01377;10.819;10.819;10.819;16-Feb-2012

Nippon India Mutual Fund
103197;NIPPON INDIA TAX SAVER (ELSS) FUND - IDCW Option;INF204K01GL2;INF204K01GM0;15.0139;15.0139;15.0139;16-Feb-2012
103196;Nippon India Tax Saver (ELSS) Fund-Growth Plan-Growth Option;INF204K01GK4;;21.3437;21.3437;21.3437;16-Feb-2012

Principal Mutual Fund
101815;Principal Personal Tax Saver Fund;INF173K01353;;88.43;88.43;88.43;16-Feb-2012
100156;Principal Tax Savings Fund;INF173K01361;;70.36;70.36;70.36;16-Feb-2012

quant Mutual Fund
100175;quant ELSS Tax Saver Fund - Growth Option - Regular Plan;INF966L01135;;41.2120;41.2120;41.2120;16-Feb-2012
100174;quant ELSS Tax Saver Fund - IDCW Option - Regular Plan;INF966L01119;;8.8611;8.8611;8.8611;16-Feb-2012

Quantum Mutual Fund
111549;Quantum ELSS Tax Saver Fund - Direct Plan Growth Option;INF082J01069;;22.956;22.956;22.956;16-Feb-2012
111550;Quantum ELSS Tax Saver Fund - Direct Plan IDCW;INF082J01077;INF082J01085;22.943;22.943;22.943;16-Feb-2012

Sundaram Mutual Fund
101853;Sundaram Diversified Equity (ELSS) Regular Plan - Growth;INF903J01538;;42.6691;42.6691;42.6691;16-Feb-2012
100614;Sundaram Diversified Equity (ELSS) Regular Plan - Income Distribution cum Capital Withdrawal (IDCW);INF903J01512;INF903J01520;10.0625;10.0625;10.0625;16-Feb-2012

Tata Mutual Fund
100474;Tata ELSS Tax Saver Fund- Regular Plan - Payout of IDCW Option;INF277K01I60;;42.7799;42.7799;42.7799;16-Feb-2012

Taurus Mutual Fund
100480;Taurus ELSS Tax Saver Fund - Regular Plan - Growth;INF044D01AC9;;34.49;34.49;34.49;16-Feb-2012
108402;Taurus ELSS Tax Saver Fund - Regular Plan - Payout of Income Distribution cum Capital Withdrawal option;INF044D01997;;16.16;16.16;16.16;16-Feb-2012

Union Mutual Fund
116051;Union ELSS Tax Saver Fund - Growth Option;INF582M01302;;11.32;11.32;11.32;16-Feb-2012
116052;Union ELSS Tax Saver Fund - IDCW Option;INF582M01328;INF582M01310;11.32;11.32;11.32;16-Feb-2012

UTI Mutual Fund
100821;UTI ELSS Tax Saver Fund - Regular Plan - Growth Option;INF789F01547;;38.21;38.21;38.21;16-Feb-2012
100820;UTI ELSS Tax Saver Fund - Regular Plan - IDCW;INF789F01521;INF789F01539;15.25;15.25;15.25;16-Feb-2012

Open Ended Schemes ( Debt Scheme - Overnight Fund )


HDFC Mutual Fund
101996;HDFC Overnight Fund - Growth Option;INF179KB1HS3;;17.2281;17.2281;17.2281;16-Feb-2012
101997;HDFC Overnight Fund - IDCW Option (Daily);;INF179KB1IF8;10.4266;10.4266;10.4266;16-Feb-2012

SBI Mutual Fund
114297;SBI Overnight Fund - Regular Plan - Daily Income Distribution cum Capital Withdrawal Option (IDCW);;INF200K01LN6;1009.9100;1009.9100;1009.9100;16-Feb-2012
101206;SBI OVERNIGHT FUND - REGULAR PLAN - GROWTH;INF200K01LQ9;;1827.1701;1827.1701;1827.1701;16-Feb-2012
103140;SBI Overnight Fund - Regular Plan - Weekly Income Distribution cum Capital Withdrawal Option (IDCW);INF200K01LO4;INF200K01LP1;1032.5289;1032.5289;1032.5289;16-Feb-2012

Open Ended Schemes ( Debt Scheme - Liquid Fund )


Aditya Birla Sun Life Mutual Fund
100047;Aditya Birla Sun Life Liquid Fund - Growth;INF209K01RU9;;169.7764;169.7764;169.7764;16-Feb-2012
100046;Aditya Birla Sun Life Liquid Fund -Daily IDCW;INF209K01KQ2;INF209K01SQ5;100.1950;100.1950;100.1950;16-Feb-2012
100041;Aditya Birla Sun Life Liquid Fund -Institutional - IDCW;;INF209K01KN9;108.0230;108.0230;108.0230;16-Feb-2012
100048;Aditya Birla Sun Life Liquid Fund -Institutional - weekly  IDCW;INF209KA1LK7;INF209K01KY6;108.2324;108.2324;108.2324;16-Feb-2012
100044;Aditya Birla Sun Life Liquid Fund -Retail - IDCW;;INF209K01KP4;163.6940;163.6940;163.6940;16-Feb-2012
100051;Aditya Birla Sun Life Liquid Fund -weekly IDCW;INF209K01KU4;INF209KA1LJ9;100.3814;100.3814;100.3814;16-Feb-2012
112014;Aditya Birla Sun Life Liquid Fund- Discipline Advantage Plan;INF209K01KZ3;;116.3773;116.3773;116.3773;16-Feb-2012
100043;Aditya Birla Sun Life Liquid Fund-Institutional (Growth);INF209K01RT1;;284.3876;284.3876;284.3876;16-Feb-2012
100042;Aditya Birla Sun Life Liquid Fund-Retail (Growth);INF209K01ME4;;278.8144;278.8144;278.8144;16-Feb-2012

Axis Mutual Fund
112211;Axis Liquid Fund - Regular Plan - Daily IDCW;;INF846K01420;1000.1031;1000.1031;1000.1031;16-Feb-2012
112210;Axis Liquid Fund - Regular Plan - Growth Option;INF846K01412;;1175.0573;1175.0573;1175.0573;16-Feb-2012
112213;Axis Liquid Fund - Regular Plan - Monthly IDCW;INF846K01453;INF846K01461;1005.7726;1005.7726;1005.7726;16-Feb-2012
112212;Axis Liquid Fund - Regular Plan - Weekly IDCW;INF846K01438;INF846K01446;1002.8548;1002.8548;1002.8548;16-Feb-2012
112712;Axis Liquid Fund - Retail Plan - Daily IDCW;;INF846K01362;1000.0746;1000.0746;1000.0746;16-Feb-2012
112713;Axis Liquid Fund - Retail Plan - Growth Option;INF846K01354;;1150.5094;1150.5094;1150.5094;16-Feb-2012
112714;Axis Liquid Fund - Retail Plan - Monthly IDCW;INF846K01396;INF846K01404;1005.5011;1005.5011;1005.5011;16-Feb-2012
112715;Axis Liquid Fund - Retail Plan - Weekly IDCW;INF846K01370;INF846K01388;1000.8008;1000.8008;1000.8008;16-Feb-2012

Bandhan Mutual Fund
108692;BANDHAN LIQUID Fund - Regular Plan - Daily IDCW;INF194K01VZ4;INF194K01VY7;1000.2500;1000.2500;1000.2500;16-Feb-2012
108690;BANDHAN LIQUID Fund - Regular Plan - Growth;INF194K01VX9;;1289.7732;1289.7732;1289.7732;16-Feb-2012
108693;BANDHAN LIQUID Fund - Regular Plan - Monthly IDCW;INF194K01WF4;INF194K01WE7;1004.3822;1004.3822;1004.3822;16-Feb-2012
115489;BANDHAN LIQUID Fund - Regular Plan - Periodic IDCW;INF194K01WC1;INF194K01WB3;1016.0675;1016.0675;1016.0675;16-Feb-2012
108691;BANDHAN LIQUID Fund - Regular Plan - Weekly IDCW;INF194K01WI8;INF194K01WH0;1001.5477;1001.5477;1001.5477;16-Feb-2012
108779;BANDHAN Liquid Fund-Plan A-Dividend (Daily);INF194K01VC3;INF194K01VB5;1058.1900;1058.1900;1058.1900;16-Feb-2012
108778;BANDHAN Liquid Fund-Plan A-Growth;INF194K01UX1;;1874.9099;1874.9099;1874.9099;16-Feb-2012
115486;BANDHAN Liquid Fund-Plan A-Monthly;INF194K01VF6;INF194K01VE9;1004.1260;1004.1260;1004.1260;16-Feb-2012
115487;BANDHAN Liquid Fund-Plan A-Periodic Dividend;INF194K01UZ6;INF194K01UY9;1015.3820;1015.3820;1015.3820;16-Feb-2012
108607;BANDHAN Liquid Fund - Plan A-Dividend (Weekly);INF194K01VI0;INF194K01VH2;1002.4653;1002.4653;1002.4653;16-Feb-2012
108781;BANDHAN Liquid Fund - Plan B (G) (Institutional Plan);INF194K01VK6;;1892.4022;1892.4022;1892.4022;16-Feb-2012
108629;BANDHAN Liquid Fund - Plan B - Dividend-Weekly;INF194K01VS9;INF194K01VR1;1001.4742;1001.4742;1001.4742;16-Feb-2012
108681;BANDHAN Liquid Fund - Plan B-Daily-Dividend(Institutional Plan);INF194K01VM2;INF194K01VL4;1058.7300;1058.7300;1058.7300;16-Feb-2012

Bank of India Mutual Fund
109257;BANK OF INDIA Liquid Fund- Institutional Plan- Daily Dividend;;;1000.0000;1000.0000;1000.0000;16-Feb-2012
109256;BANK OF INDIA Liquid Fund- Institutional Plan-Growth;INF761K01314;;1248.3590;1248.3590;1248.3590;16-Feb-2012
111971;BANK OF INDIA Liquid Fund- Regular Plan- Daily IDCW;;INF761K01CO4;1000.0000;1000.0000;1000.0000;16-Feb-2012
109254;BANK OF INDIA Liquid Fund- Regular Plan- Growth;INF761K01306;;1231.3783;1231.3783;1231.3783;16-Feb-2012
109255;BANK OF INDIA Liquid Fund- Regular Plan- Weekly IDCW;;INF761K01CP1;1000.6619;1000.6619;1000.6619;16-Feb-2012

Baroda BNP Paribas Mutual Fund
111707;Baroda BNP Paribas LIQUID FUND - Regular Plan - DAILY IDCW OPTION;INF955L01468;INF955L01476;1000.6300;1000.6300;1000.6300;16-Feb-2012
111704;Baroda BNP Paribas LIQUID FUND - Regular Plan - GROWTH OPTION;INF955L01484;;1214.6379;1214.6379;1214.6379;16-Feb-2012
111705;Baroda BNP Paribas LIQUID FUND - Regular Plan - WEEKLY IDCW OPTION;INF251K01SK0;INF955L01500;1000.8349;1000.8349;1000.8349;16-Feb-2012
101408;Baroda BNP Paribas LIQUID FUND- Defunct Plan -Growth Option;INF955L01575;;1840.9805;1840.9805;1840.9805;16-Feb-2012
101407;Baroda BNP Paribas LIQUID FUND-Defunct Plan- IDCW Option;INF955L01559;INF955L01567;1577.2636;1577.2636;1577.2636;16-Feb-2012
101409;Baroda BNP Paribas LIQUID FUND-Defunct Plan-Daily IDCW Option;INF955L01518;INF955L01526;1006.0600;1006.0600;1006.0600;16-Feb-2012

BNP Paribas Mutual Fund
113641;BNP PARIBAS LIQUID Fund-Institutional Plan-Daily Dividend Option;;;10.0030;10.0030;10.0030;16-Feb-2012
113634;BNP PARIBAS LIQUID Fund-Institutional Plan-Growth Option;;;16.3048;16.3048;16.3048;16-Feb-2012
113638;BNP PARIBAS LIQUID Fund-Institutional Plan-Monthly Dividend Payout Option;;;10.0419;10.0419;10.0419;16-Feb-2012
113642;BNP PARIBAS LIQUID Fund-Institutional Plan-Weekly Dividend Option;;;10.0013;10.0013;10.0013;16-Feb-2012
113640;BNP PARIBAS LIQUID Fund-Regular Plan-Growth Option;INF251K01CI8;;15.8151;15.8151;15.8151;16-Feb-2012
113632;BNP PARIBAS LIQUID Fund-Regular Plan-Monthly Dividend;INF251K01CK4;INF251K01CL2;10.0384;10.0384;10.0384;16-Feb-2012
113637;BNP PARIBAS LIQUID Fund-Regular Plan-Weekly Dividend Option;;INF251K01CJ6;10.0013;10.0013;10.0013;16-Feb-2012

Canara Robeco Mutual Fund
109349;CANARA ROBECO LIQUID FUND - REGULAR PLAN - DAILY IDCW (Reinvestment);;INF760K01CU3;1005.5000;1005.5000;1005.5000;16-Feb-2012
109353;CANARA ROBECO LIQUID FUND - REGULAR PLAN - GROWTH OPTION;INF760K01CW9;;1289.3129;1289.3129;1289.3129;16-Feb-2012
109350;CANARA ROBECO LIQUID FUND - REGULAR PLAN - WEEKLY IDCW (Payout/Reinvestment);INF760K01BZ4;INF760K01CZ2;1000.0000;1000.0000;1000.0000;16-Feb-2012
101363;Canara Robeco Liquid Fund- INSTITUTIONAL-Daily Dividend Reinvestment;;INF760K01CC1;1005.5000;1005.5000;1005.5000;16-Feb-2012
101362;Canara Robeco Liquid Fund- INSTITUTIONAL-Growth;INF760K01CD9;;1916.5994;1916.5994;1916.5994;16-Feb-2012
101361;Canara Robeco Liquid Fund- INSTITUTIONAL-Weekly dividend;;INF760K01CE7;1000.2435;1000.2435;1000.2435;16-Feb-2012
109357;Canara Robeco Liquid Fund-Institutional-Fortnightly Div Reinvest;;INF760K01860;1000.0000;1000.0000;1000.0000;16-Feb-2012
109352;Canara Robeco Liquid Fund-Institutional-Monthly Div Reinvest;;INF760K01894;1006.8654;1006.8654;1006.8654;16-Feb-2012
109355;Canara Robeco Liquid Fund-Regular Plan-Fortnightly Div Reinvest.;;INF760K01951;1000.0000;1000.0000;1000.0000;16-Feb-2012
101364;Canara Robeco Liquid Fund-Retail-DRI;;INF760K01CF4;1007.0000;1007.0000;1007.0000;16-Feb-2012
109346;Canara Robeco Liquid Fund-Retail-Fortnightly Div Reinvest;;INF760K01CG2;1005.7280;1005.7280;1005.7280;16-Feb-2012
101365;Canara Robeco Liquid Fund-Retail-Growth;INF760K01CH0;;1900.1774;1900.1774;1900.1774;16-Feb-2012
109347;Canara Robeco Liquid Fund-Retail-Monthly Div Reinvest;;INF760K01CI8;1010.6485;1010.6485;1010.6485;16-Feb-2012
109356;Canara Robeco Liquid Fund-Retail-Weekly Div Reinvest;;INF760K01CJ6;1005.7280;1005.7280;1005.7280;16-Feb-2012

DSP Mutual Fund
